{
  "meta" : {
    "schema_version" : "1.0.0"
  },
  "project_metadata" : {
    "external_dependencies" : { },
    "package_dependencies" : {
      "ECommerceApp.Controllers" : {
        "components_count" : 2,
        "total_dependencies_out" : 0,
        "depends_on_packages" : [ ]
      },
      "ECommerceApp.DTOs" : {
        "components_count" : 5,
        "total_dependencies_out" : 0,
        "depends_on_packages" : [ ]
      },
      "ECommerceApp.Data" : {
        "components_count" : 1,
        "total_dependencies_out" : 0,
        "depends_on_packages" : [ ]
      },
      "ECommerceApp.Models" : {
        "components_count" : 5,
        "total_dependencies_out" : 0,
        "depends_on_packages" : [ ]
      },
      "ECommerceApp.Repositories" : {
        "components_count" : 4,
        "total_dependencies_out" : 0,
        "depends_on_packages" : [ ]
      },
      "ECommerceApp.Services" : {
        "components_count" : 4,
        "total_dependencies_out" : 0,
        "depends_on_packages" : [ ]
      }
    },
    "total_components" : 22,
    "total_loc" : 591,
    "components_with_secrets" : 2,
    "shared_domain" : "ECommerceApp.DTOs",
    "secrets_locations" : [ {
      "path" : "src/ECommerceApp/appsettings.json",
      "line" : 6,
      "kind" : "API_KEY",
      "redacted" : true
    } ]
  },
  "proposals" : [ {
    "id" : 0,
    "name" : "Componente de App y Data",
    "viability" : "Baja",
    "clusters" : [ 0 ],
    "components" : [ "ECommerceApp.Data.AppDbContext", "ECommerceApp.Models.Category", "ECommerceApp.Models.Customer", "ECommerceApp.Models.Order", "ECommerceApp.Models.OrderItem", "ECommerceApp.Models.Product", "Program" ],
    "metrics" : {
      "size" : 7,
      "cohesion_avg" : 0.0,
      "external_coupling" : 0.0,
      "internal_edge_density" : 0.0,
      "data_jaccard" : 0.8,
      "tables" : [ "orders", "categories", "customers", "order_items", "products" ],
      "sensitive" : false,
      "tables_source" : "jpa"
    },
    "signals" : {
      "avg_cluster_size" : 7.0,
      "cluster_count" : 1,
      "total_components" : 7
    },
    "rationale" : [ "📊 Métricas de Calidad: CBO promedio 3,0 (acoplamiento entre objetos), LCOM promedio 0,00 (cohesión de métodos: 0=alta, 1=baja)", "❌ Baja cohesión (0%) - componentes poco relacionados que no comparten un propósito claro", "✅ Bajo acoplamiento externo (0%) - buena independencia y facilidad de mantenimiento", "✅ CBO bajo (3,0) - acoplamiento entre clases controlado, fácil de mantener", "✅ LCOM bajo (0,00) - alta cohesión de métodos, clases con responsabilidad única bien definida", "✅ Tamaño adecuado (7 componentes) - módulo de tamaño manejable", "", "⛔ RAZONES POR LAS QUE ESTA DESCOMPOSICIÓN NO ES VIABLE:", "• Los componentes no comparten suficiente funcionalidad ni datos como para formar un módulo coherente. Extraerlos juntos crearía un módulo artificial sin un propósito de negocio claro.", "", "💡 RECOMENDACIÓN: Mantener estos componentes en el monolito actual o reagrupar con otros componentes con los que compartan más funcionalidad y datos. Enfocarse primero en extraer módulos con viabilidad Alta o Media." ],
    "recommended_actions" : [ "❌ NO implementar como microservicio en estado actual", "🔧 Requiere refactorización profunda o fusión con otros dominios", "💡 Evaluar si debe ser librería compartida o módulo interno" ],
    "tables" : [ {
      "name" : "categories",
      "component" : "Componente de App y Data",
      "source" : "DEFAULT"
    }, {
      "name" : "customers",
      "component" : "Componente de App y Data",
      "source" : "DEFAULT"
    }, {
      "name" : "order_items",
      "component" : "Componente de App y Data",
      "source" : "DEFAULT"
    }, {
      "name" : "orders",
      "component" : "Componente de App y Data",
      "source" : "DEFAULT"
    }, {
      "name" : "products",
      "component" : "Componente de App y Data",
      "source" : "DEFAULT"
    } ],
    "legacy_entrypoint" : {
      "type" : "internal",
      "exposed_operations" : [ ],
      "endpoints" : [ ],
      "description" : "No se detectaron endpoints de entrada. Componente interno o de infraestructura."
    }
  }, {
    "id" : 1,
    "name" : "Componente de Negocio",
    "viability" : "Baja",
    "clusters" : [ 1 ],
    "components" : [ "ECommerceApp.DTOs.CreateOrderDto", "ECommerceApp.DTOs.CreateProductDto", "ECommerceApp.DTOs.OrderDto", "ECommerceApp.DTOs.OrderItemDto", "ECommerceApp.DTOs.ProductDto" ],
    "metrics" : {
      "size" : 5,
      "cohesion_avg" : 0.0,
      "external_coupling" : 0.0,
      "internal_edge_density" : 0.0,
      "data_jaccard" : 0.0,
      "tables" : [ ],
      "sensitive" : false,
      "tables_source" : "none"
    },
    "signals" : {
      "avg_cluster_size" : 5.0,
      "cluster_count" : 1,
      "total_components" : 5
    },
    "rationale" : [ "❌ Baja cohesión (0%) - componentes poco relacionados que no comparten un propósito claro", "✅ Bajo acoplamiento externo (0%) - buena independencia y facilidad de mantenimiento", "⚠️ Datos parcialmente cohesivos - revisar si las tablas compartidas realmente pertenecen al mismo dominio", "✅ Tamaño adecuado (5 componentes) - módulo de tamaño manejable", "", "⛔ RAZONES POR LAS QUE ESTA DESCOMPOSICIÓN NO ES VIABLE:", "• Los componentes no comparten suficiente funcionalidad ni datos como para formar un módulo coherente. Extraerlos juntos crearía un módulo artificial sin un propósito de negocio claro.", "", "💡 RECOMENDACIÓN: Mantener estos componentes en el monolito actual o reagrupar con otros componentes con los que compartan más funcionalidad y datos. Enfocarse primero en extraer módulos con viabilidad Alta o Media." ],
    "recommended_actions" : [ "❌ NO implementar como microservicio en estado actual", "🔧 Requiere refactorización profunda o fusión con otros dominios", "💡 Evaluar si debe ser librería compartida o módulo interno" ],
    "tables" : [ ],
    "legacy_entrypoint" : {
      "type" : "internal",
      "exposed_operations" : [ ],
      "endpoints" : [ ],
      "description" : "No se detectaron endpoints de entrada. Componente interno o de infraestructura."
    }
  }, {
    "id" : 2,
    "name" : "Componente de Repositories y Product",
    "viability" : "Media",
    "clusters" : [ 2 ],
    "components" : [ "ECommerceApp.Repositories.IOrderRepository", "ECommerceApp.Repositories.IProductRepository", "ECommerceApp.Repositories.OrderRepository", "ECommerceApp.Repositories.ProductRepository" ],
    "metrics" : {
      "size" : 4,
      "cohesion_avg" : 0.6666666666666666,
      "external_coupling" : 0.5,
      "internal_edge_density" : 0.16666666666666666,
      "data_jaccard" : 0.0,
      "tables" : [ ],
      "sensitive" : false,
      "tables_source" : "none"
    },
    "signals" : {
      "avg_cluster_size" : 4.0,
      "cluster_count" : 1,
      "total_components" : 4
    },
    "rationale" : [ "📊 Métricas de Calidad: CBO promedio 4,0 (acoplamiento entre objetos), LCOM promedio 0,33 (cohesión de métodos: 0=alta, 1=baja)", "⚠️ Cohesión moderada (52%) - componentes parcialmente relacionados; considerar refactorización para agrupar responsabilidades más claramente", "❌ Alto acoplamiento externo (50%) - fuertemente acoplado a otros módulos, dificultando la extracción independiente", "✅ CBO bajo (4,0) - acoplamiento entre clases controlado, fácil de mantener", "⚠️ LCOM moderado (0,33) - cohesión de métodos moderada; algunas clases podrían dividirse en clases más pequeñas", "⚠️ Datos parcialmente cohesivos - revisar si las tablas compartidas realmente pertenecen al mismo dominio", "✅ Tamaño adecuado (4 componentes) - módulo de tamaño manejable" ],
    "recommended_actions" : [ "🔧 Refactorizar para mejorar cohesión y reducir acoplamiento", "🔧 Aplicar principios SOLID (SRP, DIP) para separación de responsabilidades", "🔧 Considerar eventos asíncronos para reducir acoplamiento síncrono", "📋 Re-evaluar después de refactorización" ],
    "tables" : [ ],
    "legacy_entrypoint" : {
      "type" : "internal",
      "exposed_operations" : [ ],
      "endpoints" : [ ],
      "description" : "No se detectaron endpoints de entrada. Componente interno o de infraestructura."
    }
  }, {
    "id" : 3,
    "name" : "Componente de Services y Product",
    "viability" : "Baja",
    "clusters" : [ 3 ],
    "components" : [ "ECommerceApp.Services.IOrderService", "ECommerceApp.Services.IProductService", "ECommerceApp.Services.OrderService", "ECommerceApp.Services.ProductService" ],
    "metrics" : {
      "size" : 4,
      "cohesion_avg" : 0.18181818181818182,
      "external_coupling" : 0.6,
      "internal_edge_density" : 0.16666666666666666,
      "data_jaccard" : 0.0,
      "tables" : [ ],
      "sensitive" : false,
      "tables_source" : "none"
    },
    "signals" : {
      "avg_cluster_size" : 4.0,
      "cluster_count" : 1,
      "total_components" : 4
    },